reviewId,userName,content,score,thumbsUpCount,at,replyContent,repliedAt,version
9054a948-811f-4947-9697-7553ad6adef9,Rani R,"Ko ya makin kesini sekarang makin ga jelas ya ? Kirim paket suru nunggu 30menit, bgtu dapat masih nunggu lagi 30menitan, yg instan pun susah nya minta ampun, kita itu bayar loh, customer perlu pelayanan yg baik jg, bukan kita yg slalu ngertiin maunya aplikasi, Terima Kasih",1,4,2025-08-12T20:26:19,"Mohon maaf atas kendalanya, Kak Rani. Kesulitan mendapatkan driver bisa terjadi karena tingginya permintaan saat jam sibuk atau tidak ada driver di sekitar. Silakan tunggu dan coba kembali. Untuk info lebih lanjut, kunjungi menu Bantuan dan cari artikel ""Saya tidak mendapatkan driver"". ^Melisa",2025-08-12T23:12:41,5.24.2
a17a520d-fa90-41a3-945c-ef978b2825c6,Dwi Wahyuni,"klo pesen gojek motor lama bgt udh gitu keganti otomatis, kya ga butuh duit driver gojeknya udh berkali2 begitu, abis keganti otomatis trs dpt driver baru lg sama aja mana lama responnya, ujungÂ²nya keganti lg, cape bgt!!!!",1,0,2025-08-12T20:16:29,"Hai Kak Dwi, mohon maaf atas ketidaknyamanannya. Laporan yang kamu sampaikan akan menjadi masukan bagi kami untuk terus meningkatkan kualitas layanan kami ke depannya. Kemudian terkait keluhannya, silakan laporkan melalui menu Bantuan di aplikasi Gojek dengan mengetik ""Driver membatalkan pesanan saya"" pada kolom pencarian ya. ^Melisa",2025-08-12T23:11:02,4.80.4
13a54f7f-ff63-4e6b-b06d-0868cbe726b8,Suriani Anggono,Gojek rider harga murah ramah di kantong servis ok,5,0,2025-08-12T20:15:46,,,5.26.1
59537190-2828-4499-8dc4-021eb295658d,Fasni Mubarok,saya ingin naik gojek go ride tapi gk bisa gara gara gojek saya tidak bisa solat solat nya selalu terlambat dan khoqo saya ingin gojek nanti di akherat tanggung jawab untuk amal saya gara gara ketinggalan terimakasih ðŸ™,1,0,2025-08-12T20:13:42,"Hai Kak Fasni, mohon maaf atas ketidaknyamanannya. Agar dapat dibantu lebih lanjut, silakan laporkan melalui menu Bantuan (pada menu Profil Saya) di aplikasi Gojek dengan mengetik ""Driver menjemput terlalu lama"" pada kolom pencarian. Semoga informasi ini membantu kamu. ^Melisa",2025-08-12T23:09:39,
0672c240-37a7-4dd3-9df7-87dfef3e7af7,Adhe Safutra,Yamaha semakin didepan bersama GOJEK ðŸ‘ GASSPOLL,5,0,2025-08-12T20:01:06,,,5.27.2
bfaee8e3-cedd-4b81-a038-79b372d8acd3,Randy Raymond,Parah... Tau2 logout sendiri. Tau2 di suspend. Gw mah kamsia kl kaga mau dibayar paylaternya. Padahal rajin bayar sampai limit naik. Tau2 suspend...,5,0,2025-08-12T19:59:28,,,5.27.2
9b487333-a08c-4144-9ed1-d14fd0c50fb5,Calissta Kaila,"sangat membantu saat berhalangan mengantar atau menjemput anak sekolah, alhamdulillah selalu dapat driver yang baik dan sabar",5,0,2025-08-12T19:57:42,,,
cbb18ba6-e66f-4a56-a566-b9db02ae070b,Winda Widiastuti,dpt drivernya lama bgt padahal jaraknya deket gmn si,2,0,2025-08-12T19:40:59,"Hai Kak Winda, mohon maaf atas ketidaknyamanannya. Agar dapat dibantu lebih lanjut, silakan laporkan melalui menu Bantuan (pada menu Profil Saya) di aplikasi Gojek dengan mengetik ""Driver menjemput terlalu lama"" pada kolom pencarian. Semoga informasi ini membantu kamu. ^Melisa",2025-08-12T22:22:37,5.26.1
ec16cdd6-d37a-48ff-b814-791edcbedf52,Harun Arrasyid,terakhir gw ini pake gojek nyari driver jauh semua gofood sering telat ini fatal untuk yg terkahir kali gofoodnya lama bnget goodby gojek,1,0,2025-08-12T19:39:41,"Hai Kak Harun, mohon maaf atas ketidaknyamanannya. Laporan yang kamu sampaikan akan menjadi masukan bagi kami untuk terus meningkatkan kualitas layanan kami ke depannya. Kemudian terkait keluhannya, silakan laporkan melalui menu Bantuan di aplikasi Gojek dengan mengetik ""Saya menunggu pengiriman terlalu lama"" pada kolom pencarian ya. ^Melisa",2025-08-12T22:20:18,
c5bed369-7c25-41f1-83f4-c2b398e56aca,sandy moto,"aplikasi jelek, cuma mentingin laba aj. nyusahin customer,tiap hujan sangat susah cari driver",1,0,2025-08-12T19:26:11,"Mohon maaf atas kendalanya, Kak Sandy. Kesulitan mendapatkan driver bisa terjadi karena tingginya permintaan saat jam sibuk atau tidak ada driver di sekitar. Silakan tunggu dan coba kembali. Untuk info lebih lanjut, kunjungi menu Bantuan dan cari artikel ""Saya tidak mendapatkan driver"". ^Melisa",2025-08-12T22:19:07,4.33.1
1bae226d-0f29-4efa-89ea-4fb87933261d,Diva Saharani,kreasi amak bangsa gitu loh,5,0,2025-08-12T19:17:18,,,5.26.1
ab829773-c0e7-40ed-a007-3aff38ad5dc1,Nana Sumhana,mudah,5,0,2025-08-12T19:13:18,,,5.27.2
697d2419-bb04-4006-adc8-3206b405b723,The Deep,penyedia jasa layanan tapi layanan buruk selalu ngasih driver yang jarak nya jauh banget padahal yang deketÂ² banyak,1,0,2025-08-12T18:56:55,"Mohon maaf atas kendalanya, Kak @The Deep. Kesulitan mendapatkan driver bisa terjadi karena tingginya permintaan saat jam sibuk atau tidak ada driver di sekitar. Silakan tunggu dan coba kembali. Untuk info lebih lanjut, kunjungi menu Bantuan dan cari artikel ""Saya tidak mendapatkan driver"". ^Melisa",2025-08-12T22:10:35,
17c32053-37a6-45c5-a00f-263de464656c,Rahayu Meti,"parahhhh tiap hujan harga naik bnget, nyari driver susah, blum drama driver drop penumpang, gojek motor gak ada yg nerima padahal huja reda harga naik gak ngotak tapi pelayanan sangat lambat",2,0,2025-08-12T18:55:12,"Mohon maaf atas kendalanya, Kak Rahayu. Kesulitan mendapatkan driver bisa terjadi karena tingginya permintaan saat jam sibuk atau tidak ada driver di sekitar. Silakan tunggu dan coba kembali. Untuk info lebih lanjut, kunjungi menu Bantuan dan cari artikel ""Saya tidak mendapatkan driver"". ^Melisa",2025-08-12T22:09:32,5.26.1
14763f49-d836-4e2e-ae48-b04eaa570bfd,Syamil Rivandi,lama mencari driver setelah hujan,1,0,2025-08-12T18:41:56,"Mohon maaf atas kendalanya, Kak Syamil. Kesulitan mendapatkan driver bisa terjadi karena tingginya permintaan saat jam sibuk atau tidak ada driver di sekitar. Silakan tunggu dan coba kembali. Untuk info lebih lanjut, kunjungi menu Bantuan dan cari artikel ""Saya tidak mendapatkan driver"". ^Melisa",2025-08-12T22:05:50,5.27.2
958bb3b9-bdac-4c3f-944b-1a570b630dde,stokriper,"dapet driver ga bener di chat ga di bales, udah nunggu lama tapi ga nyampe nyampe",1,0,2025-08-12T18:41:38,"Hai Kak @stokriper, mohon maaf atas ketidaknyamanannya. Laporan yang kamu sampaikan akan menjadi masukan bagi kami untuk terus meningkatkan kualitas layanan kami ke depannya. Kemudian terkait keluhannya, silakan laporkan melalui menu Bantuan di aplikasi Gojek dengan mengetik ""Driver tidak bisa dihubungi"" pada kolom pencarian ya. ^Melisa",2025-08-12T22:04:50,
e3e9490d-7344-4793-a0e5-19e8f14b7a4f,Dwi Purnomo,"kalo ujan ngapa susah bt si pada ambil nya, mager apa gimana?",1,0,2025-08-12T18:35:08,"Mohon maaf atas kendalanya, Kak Will. Kesulitan mendapatkan driver bisa terjadi karena tingginya permintaan saat jam sibuk atau tidak ada driver di sekitar. Silakan tunggu dan coba kembali. Untuk info lebih lanjut, kunjungi menu Bantuan dan cari artikel ""Saya tidak mendapatkan driver"". ^Melisa",2025-08-12T22:03:42,5.27.2
8074c0e4-4431-4214-b0d1-7927fb29216d,Riea Rasyid,pokoknya mantap dapat promo terus,5,0,2025-08-12T18:34:05,,,5.27.2
1c3bf558-daf2-4804-a294-dfb2e844e0fa,Jeffry Ikal1894,"Satu kata buat customer servisnya,(BAD)",1,0,2025-08-12T18:30:54,"Hai Kak Jeffry, mohon maaf atas ketidaknyamanannya. Laporan yang kamu sampaikan akan menjadi masukan bagi kami untuk terus meningkatkan kualitas layanan kami ke depannya. Jika masih berkendala, silakan laporkan ke email customerservice@gopay.co.id dengan kode psr-25-224-1401-42046 di subject email. Kami tunggu detail laporan kamu ya. ^Melisa",2025-08-12T22:01:52,
77662326-482a-4722-8c5d-a23da5ff121a,irma tresnasari,"terima kasih, sangat membantu",5,0,2025-08-12T18:27:35,,,
9647cdb4-1348-4563-8f69-271a141319d7,Na Wati,kenapa tifak bisa menrima akses,5,0,2025-08-12T18:26:28,,,5.27.2
203e54ab-f640-41b2-8332-2cc549405605,Suci Indriani,gocar skrg pd ga butuh uang ya suka bgt tbtb cancel,4,0,2025-08-12T18:26:01,,,5.27.2
51beefc5-5959-4a97-a292-9ec167bd9e5b,Ha ÑÑƒ,sangat membantu,5,0,2025-08-12T18:18:00,,,5.26.1
a882f469-4474-4891-8caf-927de8afbe01,Wilda Yanti,Heran banget sama aplikasi ini padahal cuman gerimis tapi susah banget dapet drivernya disuruh aktifin pencairan cepat juga sama gaada hasilnya,1,0,2025-08-12T18:09:27,"Mohon maaf atas kendalanya, Kak Wilda. Kesulitan mendapatkan driver bisa terjadi karena tingginya permintaan saat jam sibuk atau tidak ada driver di sekitar. Silakan tunggu dan coba kembali. Untuk info lebih lanjut, kunjungi menu Bantuan dan cari artikel ""Saya tidak mendapatkan driver"". ^Melisa",2025-08-12T21:30:54,
5bf1618c-668b-4fab-ac24-4b30ad95e7b7,anak soleh,"gojeg lama"" pelayanannya ngak banget jelas order gocar XL buat ber 6 ya walpun saya cuma ber 4 biar agak legaan e e e e yang Dateng Karimun kecil bngt akhirnya desek""an trus bedanya go car XL dengan yg biasa itu apa pdhl sudah ada tulisannya untuk berpa orang dan ongkos nya lebih mahal yg XL pdhl trus pesen lagi co gar XL lagi pesenya. eehh sama Bapak drivernya dichat berpa orang yaa kak pdhl kan harusnya sudah disiapkan untuk berpa orangnya kan sudah ada go car biasa dengan yg XL bikin kapo",1,0,2025-08-12T18:08:00,"Hai Kak, mohon maaf atas ketidaknyamanannya. Laporan yang kamu sampaikan akan menjadi masukan bagi kami untuk terus meningkatkan kualitas layanan kami ke depannya. Kemudian terkait keluhannya, silakan laporkan melalui menu Bantuan di aplikasi Gojek dengan mengetik ""Kendaraan driver yang saya tumpangi kurang nyaman"" pada kolom pencarian ya. ^Melisa",2025-08-12T21:25:42,5.27.2
77bbb85e-d586-4f66-ac0b-b280a8dc5fa4,Aldy 208,lama sekali saat pesan ketika hujan,1,0,2025-08-12T18:06:00,"Mohon maaf atas kendalanya, Kak Aldy. Kesulitan mendapatkan driver bisa terjadi karena tingginya permintaan saat jam sibuk atau tidak ada driver di sekitar. Silakan tunggu dan coba kembali. Untuk info lebih lanjut, kunjungi menu Bantuan dan cari artikel ""Saya tidak mendapatkan driver"". ^Melisa",2025-08-12T21:23:15,5.27.2
76ff6da7-b393-4290-8d67-c89bef90f837,Ptr Vanjava,"tolong diperbaiki lagi manejemen dan promo programnya biar customer bisa kembali lagi ke gojek ,soalnya customer sebagian udah pada lari ke orange dan aplikasi malaysia karena promo mereka lebih unggul maksimalkan biar bisa narik customer lagi ,MAKSIMALKAN YANG UTAMA",5,0,2025-08-12T17:57:07,,,4.56.1
ae57b7ad-02b0-4b1b-b743-1d069fd9518c,Dee Channel,tidak lgi pke aplikasi ini. bener2 rugi kalo download. dan promo2 jg gada lg. pernah top up gopay 2x tp ternyta pas fi cek ga msuk pdahal di mbanking tercantum sukses dg no yg dimsukkan benar. lapor ke CS ga ditanggapi dg baik. dan layanan penawaran utk gopinjam jangan sekali2 di klik walaupun cuma iseng2. data mu bisa di curi.,1,0,2025-08-12T17:55:07,"Hai Kak Dee, mohon maat atas ketidaknyamanannya. Jika kamu masih mengalami kendala, silakan laporkan melalui email ke customerservice@gopay.co.id dengan melampirkan kode psr-25-224-1321-21285 pada subject email dan cantumkan nomor laporan kamu sebelumnya pada email yang kamu kirimkan. Kami tunggu detail laporan kamu ya. ^Melisa",2025-08-12T21:21:53,
e7330f3e-4442-4355-b73d-5202fe6b8181,Asril Pidho,"untuk masukan aja, ngasi Driver tuh yang dekat-dekat aja, jangan ngasi driver yang jarak jemputannya sama jarak ngantarnya jauhnya sama, kasihan drivernya kali.",3,0,2025-08-12T17:46:16,"Mohon maaf atas kendalanya, Kak Asril. Kesulitan mendapatkan driver bisa terjadi karena tingginya permintaan saat jam sibuk atau tidak ada driver di sekitar. Silakan tunggu dan coba kembali. Untuk info lebih lanjut, kunjungi menu Bantuan dan cari artikel ""Saya tidak mendapatkan driver"". ^Melisa",2025-08-12T21:20:09,5.27.2
b068a17e-b8ea-4a1d-8982-0152b63bface,Jennyfer Fer,love bgt bisa kemana mana tp kalau naik motor mau yang motor nya bagus lupa namanya itu susah semuanya malah yg ekonomi plsss,5,0,2025-08-12T17:38:03,,,5.27.2
9760919d-0a5c-4671-9056-93fb713bdf8b,Jenny Mamik,baik GK ada kendala,5,0,2025-08-12T17:34:13,,,5.27.2
a5995030-935c-48df-947e-61306c8b5db9,Sudono Zahir Pratama,"Sampai saat ini saya pakai Gojek merasa nyaman dan aman serta banyak sekali kemudahan yang diberikan oleh Gojek, dan berharap selalu ditingkatkan . Best Gojek....ðŸ‘ðŸ™‚ðŸ‘Œ",5,0,2025-08-12T17:30:28,,,5.27.2
4455cff5-b970-4dd4-959c-df51b7d4bb42,Baekun,"Mengapa dari dulu tidak ada tindakan untuk pendaftaran akun cs gojek, ini sangat merugikan driver karena dengan adanya pembebasan pendaftaran akun jadi banyak yang bisa mendaftar dan membuat pesanan. Jadi sering sekali disalahgunakan untuk membuat orderan fiktif dan penipuan lewat aplikasi. Dari 2018 sampai 2025 sekarang ga ada perubahan Sangat merugikan !!!!",1,0,2025-08-12T16:41:53,"Hai Kak Baekun, mohon maaf untuk kendalanya. Laporan yang Anda sampaikan akan menjadi masukan bagi kami untuk terus meningkatkan kualitas layanan kami ke depannya. Jika Anda memiliki pertanyaan atau kendala lainnya, silakan kunjungi menu Bantuan di aplikasi Gojek Driver App Anda. ^Melisa",2025-08-12T20:59:47,
40ee4f87-332b-4660-988a-1349b93c7100,Muhammad Ibrahim,"makin kesini tiki jemput malah ngk bisa yg biasanya bisa, ngk jelas",1,0,2025-08-12T15:44:51,"Hai, Kak Muhammad. Pastikan kamu sudah memberikan izin akses lokasi untuk aplikasi Gojek dan update ke versi terbaru, ya. Jika titik jemput masih bermasalah, laporkan melalui halaman Bantuan di aplikasi > ketik ""Rute dari/menuju lokasi titik jemput/antar saya bermasalah"" > pilih artikel dan isi formulirnya. Kami siap membantu. ^Maura",2025-08-12T16:03:56,5.14.2
fe43ea80-87ea-4d8c-bf1b-21251390b413,Miss Joolie,kesulitan saat ingin memesankan diluar wilayah maka alamat selalu tidak ditemukan,4,0,2025-08-12T15:31:13,,,5.28.1
4ca45ebe-d435-47be-af54-7975b682b8a9,Kefas Nee,"Aplikasi Rasis, yg jd driver rata' Kristen phobia terutama ibu' nya, bnyk yg tdk mau anterin mknn..",1,0,2025-08-12T15:24:42,"Mohon maaf ya, Kak @Kefas Nee. Kesulitan mendapatkan driver bisa terjadi karena meningkatnya jumlah pesanan di jam sibuk, atau tidak ada driver di dekat titik penjemputan. Mohon menunggu beberapa saat dan coba kembali, ya. Jika masih berkendala silakan ke menu Bantuan Gojek dengan ketik ""Saya tidak mendapatkan driver"". ^Maura",2025-08-12T16:02:46,
a08035c9-e8c8-46d5-93f5-683f044d34d4,kafi naufalputra,cocok untuk pulang pergi ke sekolah,5,0,2025-08-12T15:24:15,,,5.27.2
10eb4a89-b360-4759-9438-1ea902c53c95,Supriyanto George,bagus sekali,5,0,2025-08-12T14:42:33,,,5.27.2
ac8e456f-74ed-423e-9e66-6a5ccd3e36fa,Arif Rahman,aplikasi jelek nga benar,5,0,2025-08-12T14:35:07,"Hai Kak Arif, terima kasih atas ulasanmu. Kritik dan saran yang kamu berikan akan menjadi masukan bagi kami untuk terus meningkatkan kualitas layanan kami ke depannya. Jika kamu memiliki pertanyaan atau kendala lainnya, silakan kunjungi menu Bantuan di aplikasi Gojek kamu. ^Maura",2025-07-21T09:01:59,
3ccf7245-cb91-43b9-aa82-8c3b6ce20340,Etii Cicih,lebih cepat lebih murah untuk bepergian k mana ajh,5,0,2025-08-12T14:28:54,,,5.27.2
598b619b-b988-44b5-b78c-190de67b4853,Lutfiyah Lutfiyah,oke lahh mantap secara pelayanan,5,0,2025-08-12T14:00:44,,,5.27.2
c9cf8d26-668a-4aff-a088-8ff2da7c1608,Rima Kumari,Mantap,5,0,2025-08-12T13:44:52,,,
85505648-bbdf-4e5a-b155-2f7b5777e98b,jimmy ong,sangat memuaskan pakak gojek,5,0,2025-08-12T13:32:35,,,5.14.2
f7664cb1-66d5-44c6-8b38-7217ff9b06bc,Sana Rancasari,"Harganya mahal, mending kesana kesini pake motor sendiri aja.",2,0,2025-08-12T13:13:30,"Mohon maaf atas ketidaknyamanannya, Kak Sana. Terkait ulasanmu, kami selalu berupaya untuk memberlakukan tarif yang terjangkau bagi seluruh pelanggan agar dapat selalu menjaga kualitas layanan terbaik. Kami harap kamu senantiasa nyaman dalam menggunakan layanan Gojek. Jika ada kendala lain silakan hubungi kami di menu Bantuan. ^Maura",2025-08-12T16:00:35,5.27.2
86848a5b-fda0-4c81-a45e-c05124a08657,Yosi Fadli,sangat membantu keseharian kita,5,0,2025-08-12T12:51:23,,,
3502a184-8707-41cb-9887-55a56d4a00b3,"SUPANGAT A,AT","Admin abis di upgrad malah ga bisa masuk ini,,",1,1,2025-08-12T12:08:30,"Hai Kak Supangat, mohon maaf atas kendala yang kamu alami. Sebelum login, pastikan kamu udah pakai Gojek versi terbaru & tidak ada kendala pada akun kamu, ya. Untuk info lebih lanjut, silakan ke halaman bantuan login di aplikasi dengan cara klik ikon ""?"" > pilih ""Tidak bisa masuk ke akun Gojek"" > pilih ""Saya mendapatkan notifikasi eror"". ^Maura",2025-08-12T15:58:45,5.27.2
7b607f19-d2df-4415-a241-fa63968885a7,S w,Mudah dan sangat membantu,5,0,2025-08-12T11:29:55,,,5.27.2
b4735056-e929-45c4-a607-3381bdc623bd,Sugi Arti,baik,5,0,2025-08-12T10:10:22,,,5.27.2
875903cb-ea56-4c32-9319-29075532a12f,Yoslan Lamalota,bagus,5,0,2025-08-12T09:25:34,,,5.27.2
14ed8788-d163-4516-9cf1-88c965df229c,Riny Diana,baik,5,0,2025-08-12T09:14:25,,,5.21.1
63a218da-529f-424e-b4df-05e692f7e3a6,Moch. Fahmi Maf'udin Maf'udin,semangat,5,0,2025-08-12T08:40:46,,,5.27.2
74f930ba-0386-4fa8-9510-7030a7598cf9,Pengguna Google,"sistem bobrok, dicancel pelanggan aja akun jadi budeg 2 jam . mikir.....otak pake.",1,1,2025-08-12T08:24:32,"Hai Kak, terima kasih atas ulasannya dan mohon maaf untuk kendalanya. Laporan yang Anda sampaikan akan menjadi masukan bagi kami untuk terus meningkatkan kualitas layanan kami ke depannya. Jika Anda memiliki pertanyaan atau kendala lainnya, silakan kunjungi menu Bantuan di aplikasi Gojek Driver App Anda. ^Maura",2025-08-12T08:38:10,5.24.2
3eff30cd-0f2d-413a-8f2e-073e7fa4fb99,Habid Karel,membantu sekali,5,0,2025-08-12T08:23:11,,,5.27.2
040d664c-d42a-4cdb-bbb6-97874308048e,M.musofi Musofi,"Tolong dengan besar hati utk go ride mw jarak jauh ataupun deket klw bisa di ambill semua,giliran jarak deket order driver sibuk semua,giliran jarak jauh baru di rebutin.ðŸ™ðŸ™",4,8,2025-08-12T08:20:18,,,5.27.2
32a1cbcc-1601-4735-8c20-63eb9263d3bc,Riswandi Andi,terbaik Uda pkek gojek sudah 8th anðŸ¤©ðŸ¤©ðŸ¤©,5,0,2025-08-12T08:06:29,,,5.26.1
faed7280-7c4a-459a-a96c-f0d4dfb3da7a,Dansreyhan Fauzi,mantap lebih d tingkat kan lagi,5,0,2025-08-12T07:22:39,,,5.27.2
55ceb0ea-2c57-4a3e-b589-d58828c39b51,Komandan Muda,sangat aman dan nyaman,5,0,2025-08-12T06:20:40,,,5.26.1
afb0968a-dde7-4268-b1ec-cc81afd5a919,Rahmat Germanotta,"makin lama tarifnya makin naik aja, drivernya jarang yang tepat waktu penjemputan dan ngambil rute lama, padahal udah di kasih tau rute tercepat",3,0,2025-08-12T06:08:42,"Mohon maaf atas ketidaknyamanannya, Kak Rahmat. Terkait ulasanmu, kami selalu berupaya untuk memberlakukan tarif yang terjangkau bagi seluruh pelanggan agar dapat selalu menjaga kualitas layanan terbaik. Kami harap kamu senantiasa nyaman dalam menggunakan layanan Gojek. Jika ada kendala lain silakan hubungi kami di menu Bantuan. ^Maura",2025-08-12T07:49:15,5.27.2
95a548e0-7b82-4691-976f-8948044c8c9d,Muhammad Hasanuddin,lokasi sangat akurat ðŸ˜„,1,0,2025-08-12T05:32:27,,,5.26.1
e6c8beae-54a2-464d-bbea-6f66f46f130a,Mujta Hidin,Sangat berguna,5,0,2025-08-12T02:21:13,,,5.27.2
038b4d4d-2342-4ce8-823b-dcb450805666,Saihul Amri,"pulang kerja capek, dapet driver yg ga gerakÂ² posisi nya, ga ada info sama sekali. dpet voucher kalo gocar terlambat? broo bahkan mobilnya gak bergerak sama sekali. kalopun telat datang ga masalah. yg jadi masalah adalah Drivernya diem di tempat, dan gak ada kabar sama sekali.",1,19,2025-08-12T01:55:47,"Hai Kak Saihul, mohon maaf atas ketidaknyamanannya. Laporan yang kamu sampaikan akan menjadi masukan bagi kami untuk terus meningkatkan kualitas layanan kami ke depannya. Kemudian terkait keluhannya, silakan laporkan melalui menu Bantuan di aplikasi Gojek dengan mengetik ""Driver menjemput terlalu lama"" pada kolom pencarian ya. ^Maura",2025-08-12T07:44:18,5.26.1
ed7833a9-e077-46d6-b33a-1bed77118c31,Triii Azam,seneng bgt sering dapet banyak diskon disini tapi sayang maps.nya tidak pas,5,0,2025-08-12T01:02:59,,,
62f07378-3dc5-4b08-84e0-e1206f701b5e,ridwan hidayat,"aplikator ga jelas, pesen go food udah 2 jam ga di antar, info dari driver pihak merchant ga merasa Terima orderan, tapi di aplikasi disuruh nunggu, ga bisa di cancel, telpon call center cuma dikasih nada tunggu sampe 20 menit, aplikator tolol",1,6,2025-08-12T00:52:58,"Hai Kak Ridwan, mohon maaf atas ketidaknyamanannya. Agar dapat dibantu lebih lanjut, silakan laporkan melalui menu Bantuan (pada menu Profil Saya) di aplikasi Gojek dengan mengetik ""Saya menunggu pengiriman terlalu lama"" pada kolom pencarian. Semoga informasi ini membantu kamu. ^Miko",2025-08-12T01:26:46,5.24.2
e302a101-e45f-4fa4-9479-dcc50b64d6b7,19MR94,"untuk orderan gofood harga nya sangat fanatastis, harga menu 20rb biayaya penanganan sampe 25rb, yg pdhal driver nya gk dpet sgtu, kita bayar skitar 45rb yg sampe ke driver paling 10/15rb, miris",2,1,2025-08-12T00:29:51,"Mohon maaf atas ketidaknyamanannya, Kak @19MR94. Fokus GoFood secara keseluruhan adalah untuk terus memberikan pengalaman kuliner terbaik bagi pelanggan. Biaya Pemesanan dan Biaya Jasa GoFood digunakan untuk meningkatkan layanan kepada pengguna aplikasi, termasuk pengembangan layanan melalui inovasi dan teknologi. ^Miko",2025-08-12T01:23:19,5.27.2
c30bce19-f8e2-49ee-9c8a-c83c2940a43d,Affan Nauval,"aplikasi ini membantu pengantaran makan, ojek, dll tapi sungguh sangat memprihatinkan driver nya aneh aneh",5,0,2025-08-12T00:23:33,,,5.21.1
b3041214-43d2-48af-91a7-7b353361723f,nn st,"jangan pakai gopaynya guys,,,tingkat keamanannya gopay sangat buruk,, sering di hack dibeliin pulsa atau top up games,, mending cari aps lain kalau untuk naruh duit,, ini berdasarkan hal nyata yg saya alami,, kalau di hack saldo kita pihak gopay juga gak mau ganti,,, omon omon doang",1,0,2025-08-11T23:59:41,"Hai Kak @nn st, mohon maaf atas ketidaknyamanannya. Terkait laporanmu, silakan laporkan melalui menu Bantuan (pada menu Profil Saya) di aplikasi Gojek dengan mengetik ""Akun saya dibekukan"" pada kolom pencarian. Semoga informasi ini membantu kamu. ^Miko",2025-08-12T01:22:03,4.50.1
c1a6a225-a055-47f2-b78c-6ae39bb551b2,Reihan Bimo Aksani,"mantap aplikasinya, sangat berguna dan memudahkan pelanggan untuk pergi dan mengantar pelanggan kemanapun, pesan gofood, paket barang, driver ojek nya ramah, tepat waktu (opsional), aman, beratribut gojek, cepat (kalau diminta), bersih",5,1,2025-08-11T23:39:57,,,5.27.2
1be72ad7-bf28-42b8-863e-dcf74ca9de08,Slamet Purwadi,terimakasih pelayanan baik,5,0,2025-08-11T23:02:24,,,5.27.2
5ac64cef-d495-41f4-9c68-d3f4ae15cf41,Dessy Komalasari,meringankan dan memudahkan urusan,5,0,2025-08-11T22:58:11,,,
f6795d45-6711-4795-ac24-abbd3b2b412a,Fahim Fajari,"yg di stasiun, harga murah dengan model input kode tidak bisa di input. php doang",1,0,2025-08-11T22:54:38,"Mohon maaf atas kendalanya, Kak Fahim. Terkait laporanmu, pastikan kode voucher yang dimasukkan sudah sesuai, ya. Jika masih tidak bisa, silakan laporkan hal ini melalui halaman Bantuan > ketik ""Tidak bisa menukarkan kode promo"" di kolom pencarian > pilih artikel dan lengkapi form-nya. Kami siap membantu . ^Miko",2025-08-12T01:20:26,5.26.1
3aad1af3-d054-4134-9acf-b5460757c5a4,akhtaro ahmad,tepat waktu dan amanah,5,0,2025-08-11T22:15:59,,,
344ef0c6-980a-4d03-973d-ae36037a2b26,Febi Nurani,"aplikasi yg sangat berguna dan bermanfaat. membantu roda perekonomian masyarakat, mengantar dan menjemput penumpang. saya harap gojek selalu mensupport dan memanusiakan para driver dan juga banyakin promo hehehehe. terimakasih gojekðŸ”¥ðŸ”¥ðŸ™ðŸ™",5,0,2025-08-11T22:03:22,,,
e9497487-03df-4ac6-bd92-c476e866d436,Panji Cell,sangat cocok untuk menjadi lebih mudah untuk berjalan,5,0,2025-08-11T21:22:32,,,
57de59b9-1121-4197-bf4e-f81f12272bb7,Firli Nada Kamilliya Negara,dapetin driver nya susah bgt sih pas go food,4,0,2025-08-11T21:13:29,,,5.27.2
18b0f928-feb8-4da7-a493-32fcb7420d8e,deden 27,serba guna,5,0,2025-08-11T20:39:40,,,5.27.2
f2dd26a5-c80b-4cf5-8d9d-680d3244af8a,Baiq Gina Fatimatuzzahra,"Bisa beli makanan, bisa beli baju2 fashion gitu juga gak sih huhu",4,0,2025-08-11T20:37:50,,,
accb8522-7e11-480e-b229-b30e77451fe6,Farida Ariani,udah cocok sama aplikasi ini...ga ribet...simple utk pemesanan apapun,5,0,2025-08-11T20:32:19,,,5.26.1
2ea7481a-4566-4682-8d08-50b613ad3881,Milla Karimah,kesedot pake gojek plus tapi tetep aja untuk dapet driver cepet harus namba 2k,2,0,2025-08-11T20:00:00,"Mohon maaf atas ketidaknyamanannya, Kak Milla. Terkait ulasanmu, kami selalu berupaya untuk memberlakukan tarif yang terjangkau bagi seluruh pelanggan agar dapat selalu menjaga kualitas layanan terbaik. Kami harap kamu senantiasa nyaman dalam menggunakan layanan Gojek. Jika ada kendala lain silakan hubungi kami di menu Bantuan. ^Miko",2025-08-12T01:12:20,3.22.1
3c887ba7-75d4-4cb7-a8e2-305735b1fe26,Asriati 6,banyak promo,5,0,2025-08-11T19:39:58,,,5.27.2
a3e57f60-9082-434d-801e-546f0f01d8dd,VIOLA LOUNDRY,pake gojek aman murah dan pastinya dijemput langsung depan rumah... makasi gojek,5,0,2025-08-11T19:03:55,,,5.27.2
8be6d1d0-5a0a-450e-8534-bc6f2ee4727e,Aam Amelia,Dapet supir yang sabar di jalan yang macet itu sesuatu bangett looh,5,0,2025-08-11T19:03:40,,,5.26.1
c9164243-63b4-4573-bde5-8608c7bb9749,Anang Pamungkas,"banyakin voucher diskon, ngga hanya cm pake gopayz tunai qriss pun juga",5,0,2025-08-11T18:54:08,,,5.26.1
a58e6e41-3720-4f7d-a8f6-a13e1dd17b67,Husnul Wardatus Syawal,"lama mesen doang, sekalinya dapet di cancel kocagg",3,0,2025-08-11T18:24:10,"Hai Kak Husnul, mohon maaf atas ketidaknyamanannya. Laporan yang kamu sampaikan akan menjadi masukan bagi kami untuk terus meningkatkan kualitas layanan kami ke depannya. Kemudian terkait keluhannya, silakan laporkan melalui menu Bantuan di aplikasi Gojek dengan mengetik ""Driver membatalkan pesanan saya"" pada kolom pencarian ya. ^Miko",2025-08-11T19:32:36,
cc150516-2ef2-431d-83a6-0b347b38ae99,Suharto Suharto,pelayanan cepat dan ramah,5,0,2025-08-11T17:59:12,,,
9481df4c-77ec-4636-bc9d-ac8dbf53e2db,Warnipah 15,pelayanan baik,5,0,2025-08-11T17:54:19,,,5.26.1
5b789663-1187-4da2-9533-be4f410d3f79,Anis Sopiah84,"cuaca lagi panas panasnya,mager nyari makanan d luar.gofoodin aj ðŸ‘ðŸ‘ðŸ‘ðŸ‘",5,0,2025-08-11T17:49:48,,,5.27.2
